[
  {
    "schema_version": "1.0.0",
    "id": "plant:monstera_deliciosa",
    "scientific_name": "Monstera deliciosa",
    "rank": "species",
    "taxonomy": {
      "kingdom": "Plantae",
      "phylum": "Tracheophyta",
      "class": "Liliopsida",
      "order": "Alismatales",
      "family": "Araceae",
      "genus": "Monstera"
    },
    "names": [
      {"name": "龟背竹", "language": "zh-CN", "kind": "project_alias"},
      {"name": "Swiss cheese plant", "language": "en", "kind": "common"}
    ],
    "synonyms": ["Monstera borsigiana"],
    "identity_source_ids": ["source:gbif_monstera_deliciosa"],
    "review_status": "approved",
    "updated_at": "2026-08-11"
  },
  {
    "schema_version": "1.0.0",
    "id": "plant:epipremnum_aureum",
    "scientific_name": "Epipremnum aureum",
    "rank": "species",
    "taxonomy": {
      "kingdom": "Plantae",
      "phylum": "Tracheophyta",
      "class": "Liliopsida",
      "order": "Alismatales",
      "family": "Araceae",
      "genus": "Epipremnum"
    },
    "names": [
      {"name": "绿萝", "language": "zh-CN", "kind": "project_alias"},
      {"name": "Golden pothos", "language": "en", "kind": "common"},
      {"name": "Pothos", "language": "en", "kind": "common"}
    ],
    "synonyms": ["Pothos aureus", "Scindapsus aureus"],
    "identity_source_ids": ["source:gbif_epipremnum_aureum"],
    "review_status": "approved",
    "updated_at": "2026-08-11"
  },
  {
    "schema_version": "1.0.0",
    "id": "plant:dracaena_trifasciata",
    "scientific_name": "Dracaena trifasciata",
    "rank": "species",
    "taxonomy": {
      "kingdom": "Plantae",
      "phylum": "Tracheophyta",
      "class": "Liliopsida",
      "order": "Asparagales",
      "family": "Asparagaceae",
      "genus": "Dracaena"
    },
    "names": [
      {"name": "虎尾兰", "language": "zh-CN", "kind": "project_alias"},
      {"name": "虎皮兰", "language": "zh-CN", "kind": "project_alias"},
      {"name": "Snake plant", "language": "en", "kind": "common"}
    ],
    "synonyms": ["Sansevieria trifasciata"],
    "identity_source_ids": ["source:gbif_dracaena_trifasciata"],
    "review_status": "approved",
    "updated_at": "2026-08-11"
  }
]
